{
  "type": "invitation",
  "schemaVersion": 1,
  "invitationId": "capIdCAPIDcapIdCAPIDcapIdCAPIDcapIdCAPID",
  "inviterDeviceKeyId": "a1b2c3d4e5f6a1b2c3d4e5f6a1b2c3d4e5f6a1b2c3d4e5f6a1b2c3d4e5f6a1b2",
  "inviterPublicKey": {
    "kty": "EC",
    "crv": "P-256",
    "x": "ABCDEFGHIJKLMNOPQRSTUVWXYZabcdefghijklmnopA",
    "y": "ZYXWVUTSRQPONMLKJIHGFEDCBAzyxwvutsrqponmlkj"
  },
  "role": "owner",
  "createdAt": 1700000000,
  "expiresAt": 1700000900,
  "signature": "ABCDEFGHIJKLMNOPQRSTUVWXYZabcdefghijklmnopqrstuvwxyz0123456789_-ABCDEFGHIJKLMNOPQRSTUV"
}
